{
  "schemaVersion": 1,
  "pr": {
    "owner": "acme",
    "repo": "billing",
    "number": 482,
    "headSha": "9f3c2a1b7e4d5c6f8a9b0c1d2e3f4a5b6c7d8e9f",
    "baseRef": "main",
    "headRef": "feat/export-csv",
    "author": "jdoe",
    "authorAssociation": "CONTRIBUTOR"
  },
  "verdict": "REQUEST_CHANGES",
  "confidence": "high",
  "summary": "This PR adds a CSV export endpoint for invoices. The feature is wanted (linked issue #470 has maintainer sign-off) and the structure is clean, but the query builds SQL by string concatenation from a user-supplied filter, which is an injection path, and the export is never exercised end to end in the proof provided.",
  "changeSummary": "Adds GET /invoices/export.csv that streams the caller's invoices as CSV, filtered by an optional status query parameter.",
  "productReview": {
    "worthIt": "yes",
    "userProblem": "Finance users need to pull invoices into spreadsheets without copying from the UI.",
    "rationale": "Requested in #470, approved by the billing area owner in that thread. Scope matches the request; no extra options or defaults were introduced."
  },
  "findings": [
    {
      "id": "F1",
      "title": "SQL built by concatenating the status query parameter",
      "body": "`status` comes straight from `request.args` and is interpolated into the WHERE clause. A request like `?status=paid' OR '1'='1` returns every tenant's invoices. Use a bound parameter; the ORM already supports `.filter(Invoice.status == status)`.",
      "priority": "P0",
      "category": "security",
      "confidenceScore": 0.97,
      "file": "app/invoices/export.py",
      "lineStart": 41,
      "lineEnd": 42,
      "suggestion": "    query = Invoice.query.filter(Invoice.tenant_id == tenant.id)\n    if status:\n        query = query.filter(Invoice.status == status)"
    },
    {
      "id": "F2",
      "title": "CSV writer does not escape cells that start with =, +, -, @",
      "body": "Invoice `memo` is user-entered text and is written verbatim. A memo of `=HYPERLINK(...)` executes as a formula when the export is opened in Excel. Prefix such cells with a single quote or use a library that does CSV-injection escaping.",
      "priority": "P1",
      "category": "security",
      "confidenceScore": 0.9,
      "file": "app/invoices/export.py",
      "lineStart": 58,
      "lineEnd": 58,
      "suggestion": null
    },
    {
      "id": "F3",
      "title": "Export reads all rows into memory before streaming",
      "body": "`rows = query.all()` materialises the full result set, so a tenant with 500k invoices will exhaust worker memory before the first byte is sent. `query.yield_per(1000)` keeps the streaming response actually streaming.",
      "priority": "P2",
      "category": "performance",
      "confidenceScore": 0.85,
      "file": "app/invoices/export.py",
      "lineStart": 50,
      "lineEnd": 50,
      "suggestion": "    rows = query.yield_per(1000)"
    }
  ],
  "securityReview": {
    "status": "needs_attention",
    "summary": "Two concrete injection paths in a new user-facing endpoint; both are fixable in this PR.",
    "concerns": [
      { "kind": "injection", "detail": "SQL string concatenation from query parameter (see F1).", "file": "app/invoices/export.py", "line": 41, "blocking": true },
      { "kind": "injection", "detail": "CSV formula injection via unescaped memo field (see F2).", "file": "app/invoices/export.py", "line": 58, "blocking": true }
    ]
  },
  "testingReview": {
    "proofPath": "unit_only",
    "proofStatus": "insufficient",
    "missingE2e": "A request against the running service that downloads the CSV and opens cleanly, including one row with a comma and a quote in the memo.",
    "lowValueTests": [
      "test_export_returns_200 asserts only the status code and would pass with an empty body."
    ]
  },
  "rating": {
    "proofTier": "C",
    "patchTier": "D",
    "overallTier": "D",
    "rationale": "Useful feature with clear structure, held back by two injection defects and unit-only proof."
  },
  "risks": [
    "The endpoint has no rate limit; a large tenant can trigger repeated full-table scans. Decide whether the existing per-route limiter should cover it before this ships."
  ],
  "praise": [
    "Tenant scoping is applied at the query root rather than filtered afterwards.",
    "The route is documented in the OpenAPI spec in the same PR."
  ],
  "questions": [
    "Should `status` accept a comma-separated list, as the UI filter does?"
  ],
  "inlineComments": [
    {
      "file": "app/invoices/export.py",
      "line": 23,
      "startLine": null,
      "side": "RIGHT",
      "body": "Nit: `EXPORT_CHUNK` is defined but unused after the refactor in this PR."
    }
  ]
}
